id	title	abstract
133	英国海军再曝丑闻，核潜艇指挥官醉酒熏熏，手拿烧鸡指挥洲际导弹	原标题：英国海军再曝丑闻，核潜艇指挥官醉酒熏熏，手拿烧鸡指挥洲际导弹英国皇家海军虽然经过多年的衰弱，今天的实力已经不能和大国海军媲美，但通常认为，皇家海军还是一支精锐的作战力量，武器装备和人员素质还是相当高的。虽然这样的印象可能和事实差距不大，但英军这些年来出现的一些问题，还是令人怀疑当年的日不落帝国海军，到了今天是不是把最后的本事都忘得差不多了。据俄罗斯卫星网10月20日消息报道，英国皇家海军内部发生了一起丑闻事故，涉嫌潜艇指挥官醉酒指挥。据悉，当时英军的“警惕”号战略导弹潜艇，停靠在美国佐治亚州的金斯湾基地准备卸载携带的16枚“三叉戟”潜射洲际弹道导弹。负责指挥卸载工作的指挥官，是英军中尉伦鲁夫，但这位指挥官显示出一副饮酒过多的醉态，而且手上居然拿着一支烤鸡。换班的军官当时便发现了问题，判断他不可能继续对核武器负责，因此随后向上级报告了这个问题。目前，这位犯错的中尉已经被调集，正准备接受进一步的检查。这次出现事故的潜艇是英军前卫级核潜艇4号舰，作为英国皇家海军的核心水下战力使用。由于英国没有陆基核导弹或者战略轰炸机，英国作为一个核国家，全部的战略核打击力量都要依靠数量不多的这些核潜艇。而前卫级战略核潜艇，按照英国人的说法，是世界上最先进的一级战略核潜艇之一，拥有4具533mm鱼雷发射管，和16枚三叉戟潜射洲际弹道导弹。按照每枚导弹最多12个分弹头来算，单艘前卫级潜艇最多可以发射192枚核弹头。同时，由于采用大量但消音技术，其噪音水平被认为在105分贝左右，这是接近甚至超越美军海狼级、俄军亚森级核潜艇的指标，仅此一项便可看出其先进程度。目前，英军建造了4艘前卫级核潜艇，全部在役，而这次出事的警惕号其实也是这级潜艇中最新的一艘。作为英国目前唯一的战略核力量支柱，4艘前卫级核潜艇理当受到极高的重视，而且技术水平似乎也能够符合英军的那种小而精的需要。但问题是，英军核潜艇部队发生丑闻不是一次两次了，仅仅是这艘警惕号潜艇，就有过多次前科。多年来，由于该艇艇员屡次被媒体曝光吸毒、擅离职守甚至性丑闻。“警惕”号核潜艇被英媒称为“色情和可卡因”号。就在10月初，潜艇上的35名艇员违规前往基地外的酒吧餐馆包括色情场所，随后就在新冠病毒检测中呈阳性，而这其中还有艇上的一名医生和一名副艇长。令人大跌眼镜的是，这名副艇长还是全艇唯二掌管着核武器发射密码的人。2015年，英国海军机械师通维基解密爆料前卫级的30项安全及安保漏洞，包括随意进出潜艇控制室，以及进出的手提包都没有检查。2017年10月，多达9名英国皇家海军警惕号核潜艇海员，因为饮酒过多而被解职。此前，这艘潜艇还曝出艇长及副手与艇上的女下属，存在不正当关系，导致多人被免职。加上这一次，指挥导弹装填的指挥官醉酒行动，英军这艘核潜艇堪称丑闻不断。不过，出现这些问题，其实也是英国皇家海军的一个缩影。今天的英军，实际上不太可能受到战争威胁，其战略俄核潜艇力量，与其说是国之重器，不如说是国家的面子工程。英国和美国是核心盟友关系，英国受到美国的核保护伞支持，其实本来不需要自己的核力量，英国的前卫级核潜艇，除了在阿富汗战争期间远远地打了几枚巡航导弹导弹，根本就没什么任务。况且，英国也没什么可能性遭到核打击，这样一来，部队官兵内部的战意是很淡泊的，本来就没把自己当什么重要力量。这种情况，在德国也同样严重，本质上是和平太久了还不受威胁，都快忘记战争的样子了。返回搜狐，查看更多责任编辑：
134	印度“雷达杀手”射程翻番但技术稳定性制约战场表现	原标题：印度“雷达杀手”射程翻番但技术稳定性制约战场表现10月9日，印度成功试射了首款国产反辐射导弹。这款名为“Rudram-1”的导弹，由印度国防研究与发展组织（DRDO）研发，可用苏-30MKI战斗机搭载发射。这已经是近日印度试射的第五种导弹武器。比起之前的导弹武器，此次反辐射导弹的试射更让人关注。反辐射导弹又称反雷达导弹，被誉为是现代战争的“开门斧”，它可以利用对手雷达的电磁辐射进行导引，从而摧毁敌方雷达及其载体，让对手变为“瞎子”。为此，印度国防部部长辛格专门在推特上对该导弹的成功发射表示了祝贺。江苏海事学院士官学院院长、军事专家袁周告诉科技日报记者：“按照印度媒体的说法，Rudram-1导弹的最大射程可达250公里，是世界上射程最远的反辐射导弹。2019年1月，印度国防研究与发展组织就成功试射了印度国产的NGARM反辐射导弹。此次试射的Rudram-1导弹是在NGARM基础上发展而来的。相对于NGARM，Rudram-1的确取得了明显的技术进步。”研发需突破两大技术难题根据印度官方声明，Rudram-1导弹是印度空军在广阔的对峙范围内有效压制敌人防空力量的一种有力武器。声明中说：“有了这些武器，说明印度已经拥有了自主研发远程空射反辐射导弹的能力，能够对抗敌人的雷达、通信和其他发出辐射的目标。”“反辐射导弹是对雷达硬杀伤最有效的武器，也有‘雷达杀手’之称。”袁周介绍，“目前反辐射导弹已经发展了四代，先进的反辐射导弹具有射程远、威力大、速度快、抗干扰能力强的特点。美国、俄罗斯等国在反辐射导弹技术上处于领先地位。”袁周指出，总体来看，研发先进反辐射导弹主要有两大技术难题，一是武器小型化。早期的反辐射导弹为了实现射程远、打击效果好，往往都采用了很大的弹体，这就限制了载机的载弹量，从而影响战斗力，现代反辐射导弹在不影响打击效果的前提下，实现了弹体的小型化，然而这一技术绝大部分国家并没掌握。二是制导方式复合化。早期反辐射导弹都是采用单一的被动雷达制导，即导弹本身不发射雷达波，而主要依据对方雷达辐射的能量来探测追踪目标，然而一旦对方雷达关机，导弹就会失去目标，从而影响命中率。现代先进的反辐射导弹都采用了复合制导的方式，从而有效避免了上述情况的出现，大大提高了命中率。当然，只有少数国家才能够掌握这样先进的制导技术。据印度方面的消息，Rudram-1导弹最大射程将达到250公里，这个射程超越了绝大多数野战防空系统的射程。同时该导弹配备有INS-GPS导航系统（惯性导航系统/全球定位系统）和用于末段打击的被动引导头，能够以极高的精度命中目标。“因此，如果按照印度方面放出的信息，Rudram-1导弹性能卓越，堪称世界一流的反辐射导弹。”袁周说。射程更远、打击精度更高公开资料显示，印度的反辐射导弹计划始于2012年。印度政府于2013年1月批准本土反辐射导弹研发项目，项目计划完成日期为2017年12月。但因种种原因，这个项目延期了，正如印度的其他国防军工项目一样。2019年1月，印度国防研究与发展组织成功试射NGARM反辐射导弹，射程在18公里至100公里之间。而今年的Rudram-1导弹最大射程将达到250公里，翻了一倍有余。“相比NGARM，Rudram-1不仅射程变得更远，而且打击精度更高。去年印度试射NGARM反辐射导弹时，在100公里外对目标物进行攻击时误差在10米以内，而这次却非常精准地命中目标。它不仅打得远，而且飞得也很快，可以达到和美国的‘哈姆’AGM-88E型反辐射导弹一样飞行速度，最大飞行速度可达2马赫。”袁周表示。印度媒体还宣称Rudram-1实现了复合制导，采用了中段惯性GPS制导和末段半主动雷达制导和被动雷达制导相结合的复合制导方式，从而使对方雷达在关机的状态下，也可以确保有效摧毁。有媒体称，这使得Rudram-1可比肩“哈姆”反辐射导弹。但袁周却表示：“如果印度媒体说的Rudram-1的性能都是真实的，那么Rudram-1就不是比肩‘哈姆’反辐射导弹了，而是实实在在的超越。”袁周指出，印度的说法很可能有夸大其词的成分，实际性能可能不会像印度媒体吹嘘得那么厉害。即使印度媒体说的都是事实，但印度自产导弹的稳定性如何，还有待进一步考察。相关技术仍不成熟不稳定有报道显示，反辐射导弹研制过程中，尽管印度一再声称NGARM导弹是印度国产，但有DRDO消息人士表示，该机构无法自行研发NGARM导弹，而且寻求了俄罗斯的技术帮助。对这种说法，袁周表示，印俄两国在导弹技术上有着比较深度的合作，“布拉莫斯”超音速巡航导弹就是印俄合作的成功之作。印度出钱、俄罗斯出技术的合作模式已经成为印度研制新型导弹武器的重要途径。NGARM反辐射导弹也遵循了这一模式，印度通过出钱购买俄罗斯的反辐射技术从而实现“所谓”的国产化，但核心技术其实一直掌握在俄罗斯手中，印度充其量只是将从俄罗斯进口的核心部件进行组装而已。NGARM反辐射导弹参照的对象应该是俄罗斯比较先进的KH31P反辐射导弹。“从印度近两次反辐射导弹的成功试射，我们不难看出近年来，印度在研制先进导弹领域进行了巨大的投入，也取得了不小的进步。”袁周说。在过去一个月的时间内，印度已进行了5种导弹武器的试射，分别是高超音速技术验证飞行器、增程版“布拉莫斯”导弹、Shaurya战略导弹、新型反潜导弹以及反辐射导弹。而这5种不同的导弹武器分别代表了印度导弹武器技术不同领域的进展。对此，袁周指出：“印度频繁进行导弹试射，是一种‘不能而示之能’的心理表现，有给自己壮胆的用意在里面。这5款导弹都被印军视为杀手锏武器，是印度突破对方空防体系，打击对方战略目标的重要工具。只不过，印度导弹技术有限，上述5款武器要么还不成熟，必须在试验室里再呆上相当长的时间才有可能装备部队，要么就是技术性能还不稳定，虽已服役，但是经常出故障，达不到印军所期望发挥的战略作用。”（张强）声明：转载此文是出于传递更多信息之目的。若有来源标注错误或侵犯了您的合法权益，请作者持权属证明与本网联系，我们将及时更正、删除，谢谢。[责任编辑:]返回搜狐，查看更多责任编辑：
135	美欲打造新型空天运输机，载重60吨每小时飞行20000公里，货物士兵都可用运输	原标题：美欲打造新型空天运输机，载重60吨每小时飞行20000公里，货物士兵都可用运输货物运输和兵力投送有陆上、海上和空中三种方式，这三种方式各有各的特点和优势，陆上兵力投送和货物运输的优点是输送规模大，但无法跨海域进行洲际投送，海上兵力投送恰恰解决了这一问题，但海上兵力投送速度太慢。美军在历次军事行动中会用大型运输船甚至是航空母舰输送各种物质，但这些物资往往会在海上漂浮几个月才能到达目的地。美军空天运输机想象图三种运输方式中，速度最快的当属空中运输。大型运输机虽然都不能超音速飞行，但相比路上和海上运输，运输机的速度提高了好几个层次，是快速兵力投送的最佳选择。虽然运输机的运载能力相比陆地的火车和大型运输船逊色很多，但空中运输侧重的本就是速度而不是量。近日，美军公布了新一代空中运输工具的研发计划，这种新型运输工具不仅要打破运输机不能超音速飞行的局限，而且要实现十几倍音速的飞行。空天运输机的货物舱美军计划打造的这种新型空中运输工具并不是传统意义上的运输机，而是一种空天运输机，因为它的动力来源和载体不是普通运输机而是火箭！这种涉及太空火箭的项目自然少不了SpaceX，事实上这种新的运输工具正是以SpaceX公司的“猎鹰”重型火箭为基础进行研发，力争实现运输火箭的重复使用。而这种新型空天运输机最大的特点和唯一的优势就是速度快！空天运输机以猎鹰重型火箭为基础打造普通运输机的飞行速度都是亚音速，但这种空天运输机的最大飞行速度每小时可达20000公里，也就是16倍音速，这个速度不仅远远超过运输机，甚至有的弹道导弹都达不到这个速度。美军计划中的这种空天运输机的最大载重为60吨，与运20运输机差不多，有了这种空天运输机，美军可在一小时内把60吨物资投放到全球任意一个地点。空天运输机会飞出大气层有网友担心：同样是载重60吨的空中运输工具，运20是亚音速飞行并且航程有限，美军这种空天运输飞机是16倍音速可环球航行，这样运20岂不是服役即落后？其实不必担心，因为这种空天运输机目前仅存在于预想中，距离原型机的出现遥遥无期，因为还有几个核心的技术问题当前无法解决，首先就是飞行成本！空天运输机的个头比猎鹰大很多C-17战略运输机的最大载重是80吨，其环绕地球一圈的飞行成本在100万美金左右，但“猎鹰”重型火箭发射一次的成本超过5000万美金，以“猎鹰”为基础打造的更大型空天运输机的发射成本自然更高，虽然速度提高了几十倍，但成本同样提高了几十倍。其次就是运输目标的局限性，由于速度太快并且会飞出大气层，这种空天运输机只能运输货物，虽然美军计划未来会解决运输士兵的技术问题，但让一群经历了这种飞行的士兵落地即具备作战能力以目前的技术无法解决，如果落地需要一段时间适应调整，就失去了这种快速投送的意义。空天运输机的发射成本极高还有一个问题是货物的投方方式，“猎鹰”重型火箭虽然可以实现原地降落，但这需要复杂系统的支撑，如果采用这种垂直降落方式，那么这种太空运输机对降落地点的要求就非常苛刻，无法像运输机那样一个普通机场即可。如果在亚轨道投放货物舱，那么运输士兵将更加难以实现。总之，这种空天运输机距离进入实质化阶段还有漫长的时间。美军空天运输机或仅仅是看起来很华丽美军近些年研发了不少看起来很华丽但实际效果却很差的装备，如朱姆沃尔特级驱逐舰，这种空天飞机或许也是仅仅看起来很华丽。有一句话说的好：事情往往是美国负责想象，我们负责实现！接下来的时间里，我们率先研发出更加成熟的超音速运输工具也不是不可能，因此担心运20服役即落后的网友大可放心，我们的运20好用着呢！返回搜狐，查看更多责任编辑：
136	大批舰机分4路封堵海峡，美急令3国派飞机监视，警告不许开第一枪	原标题：大批舰机分4路封堵海峡，美急令3国派飞机监视，警告不许开第一枪据俄塔斯社10月12日报道，近期，伊朗自主设计建造的最大潜艇之一法塔赫级潜艇、从俄罗斯进口的基洛级潜艇塔里克号以及自己生产的小型潜艇卡迪尔级，兵分四路演练在水下封锁霍尔木兹海峡。法塔赫潜艇是伊朗研制的最先进的潜艇，该艇排水量500吨左右，具备4个533mm鱼雷发射管，能够发射导弹和鱼雷，伊朗称其在水下自持力为35天。塔里克号潜艇是俄制基洛级，被称为大洋黑洞，静音性能非常突出，伊朗对这艘潜艇进行了现代化升级。五角大楼紧急出动3架无人机前往侦察，由于被伊朗防空火力拦截无法接近，美要求沙特，阿联酋和以色列派飞机监视。美方想要了解伊朗潜艇的作战性能，非常看重此次演习。不过伊朗在演习开始前已经划设了禁飞区，禁止无关的飞行器进入演习区域。美伊关系非常的紧张，如果美军的无人机敢闯禁飞区，伊朗可能真的敢击落。毕竟伊朗曾捕获国美军的RQ-170无人机，并击落过RQ-4B无人机。美方的飞机不敢过于靠近，就要求盟友沙特、以色列等国出动侦察机对这场演习进行严密的监视。五角大楼警告伊朗不许开第一枪，否则美国及其盟友将发动最严厉的制裁。五角大楼为了保障盟友飞机的安全，公开警告伊朗，如果敢于攻击这些在国际空域飞行的侦察机，将遭受更加严厉的制裁。联合国针对伊朗的武器禁运将在本月结束，美方一直希望找到借口，延长禁运时间，不过美方的草案在安理会遭到否决。如果伊朗敢开第一枪，攻击美军或者盟友的侦察机，美军很可能以此为借口，重新要求对伊朗实施制裁。目前在对伊朗进行制裁的问题上，美方得不到英法等盟友的支持。伊朗军方表示将击落闯入禁飞区的美军无人机，已经威胁到伊朗潜艇的反潜飞机。伊朗的态度同样很强硬，公开表示，如果美军的无人机敢于闯入禁飞区，伊朗军方将击落它。同时如果有反潜飞机闯入演习区域，并对伊朗潜艇进行水声定位追踪，甚至投放深水炸弹，伊朗将果断击落这样的反潜飞机。无人机即使被击落也不会有人员伤亡，即使被击落造成的影响也会小一点，因此击落的击落条件放的很低，对于有人的反潜飞机还是有一定的顾虑。针对伊朗的武器禁运即将到期，美方的围堵政策已经失败。这一次不止是俄罗斯否决了美方的草案，包括美传统盟友同样不赞成美方的政策。实际上美方围堵伊朗并没有阻止伊朗的军事进步，伊朗自己发展了500吨级的潜艇，发展了流星系列导弹，如果不是伊核协议的限制，伊朗在核武器的研发上可能也会有很大的进步。欧洲可能意识到了这一点，拒绝配合美方制裁，同时欧洲在伊朗也有很大的经济利益。目前伊朗已经与俄罗斯达成了购买S400防空系统的协议，伊朗会快速更新一批武器装备。▽返回搜狐，查看更多责任编辑：
137	双发重型战斗机有何魅力，为何听说中国成功后，印度赔本也要搞	原标题：双发重型战斗机有何魅力，为何听说中国成功后，印度赔本也要搞众所周知，就军事领域来说，我们隔壁的邻居印度就一直和我们杠上了，只要是有了什么新型技术突破往往第一个就要和我国进行比较。由于我国的资源广袤，不少国家都对我国的领土和资源一直虎视眈眈，印度也不例外，自从1962年对印自卫反击战结束后，虽然印度在短时间内消停了一段时间，但是后来还是在不断的搞小动作。上世纪，由于我国刚刚结束了多年的战乱，国家百废待兴，以致于在武器装备方面一直落后于很多国家，历经多年战争的我国也深刻的意识到了这一点，在苏联的帮助下我们开始慢慢的开启了自己的工业化时代。经过多年追赶，在武器装备方面我们也慢慢的实现了国产化，不再像以前那样，什么都需要向国外进口。但是，在一些领域我们的起步还是比较晚，和一些发达国家之间还是存在着不小的差距，而先进的战斗机就成为了我们当时最迫切需要的东西，因为西方国家经常对我们实施各种制裁和禁运，所以我们只能把目光放在了曾经的老大哥苏联身上，最终经过艰难的谈判之后，我们获得了老大哥最新研制的“苏-27”重型战斗机，并且获得了俄罗斯的许可开始在本国生产和制造苏-27战斗机，由于当年俄罗斯向我们转移了苏-27战斗机的资料再加上在本土生产的经验，我们最终成功的将苏-27国产化，有了如今的歼-11、歼-16和歼-15战斗机。由于苏-27战斗机属于双发重型战斗机，比起单发战斗机，无论是在续航能力、载弹量及攻击能力方面都有着很大的优势，看到我国成功将苏-27国产化后，隔壁的印度也开始打起了小算盘。近年来，印度在军事领域方面也取得了长足的进步，不过大家都心知肚明这些成就都是用钱买来的。虽然，印度已经有了自己国产的光辉战机，但却是在法国达索公司的帮助下完成的，即便这样自己的光辉战斗机还是状况百出。所以，对于双发重型战斗机，印度也知道想要靠自己独立搞出来基本上是不可能的事情。从国外引进技术授权及全套的生产设备还是比较靠谱，很快，印度就找到了苏-27战斗机的娘家俄罗斯苏霍伊公司想要获得苏-27战斗机的升级版苏-30战斗机出口及生产授权，重点强调了必须要在印度本土进行生产，价格方面好商量。收到印度的要求后，俄罗斯苏霍伊公司还是决定先去印度进行考察一下再做决定，到达印度之后，经过俄罗斯专家的评估后，给予了印度人“虽然很遗憾，但是中国人可以做到，你们印度并不具备这个能力”，这让心怀壮志的印度听了自然是很不高兴，不信邪的印度依然采购了苏-30的生产线。之前，俄罗斯专家已经指出来印度的问题，国产航空底子薄弱、战斗机研究断代、没有独立自主的完整军工体系，建议其先打好基础，不然就算采购了生产线还是需要从俄罗斯进口零配件。果不其然，在印度自己生产苏-30战斗机之后，不过印度斯坦福航空公司为印度军方生产出来的战斗机不仅比苏霍伊原厂生产的战斗机在价格方面贵了一大圈，就在质量上面也是惨不忍睹，据悉自从印度军方装备苏-30战斗机之后，原本从俄罗斯苏霍伊公司生产的战机并没有什么大问题，反而后来由自家的斯坦福航空公司生产的苏-30MKI事故率却高的吓人。不过，这么多的事故率并没有打倒一向乐观的印度人，在看到我国的隐身战斗机歼-20成功出炉后，印度又雄心勃勃的拿出了自己的隐身战机设计方案，与此同时，看到我国的国产航母下水后，又迅速公布了自己的核动力航母研制计划，殊不知自己的首艘国产航母建了15年还在造船厂里面泡水。一味地好高骛远只会越走越远，直到现在印度还没有将苏-30国产化的问题解决，又订购了法国的阵风战斗机，如今的印度军队各种武器就像一个大杂烩，就像我国刚开始的武器装备被人嘲笑为万国货一样。双发重型战斗机，似乎对于印度来说只是一个美好的梦想，想要实现还有很长的路要走。返回搜狐，查看更多责任编辑：
